{
  "version": "1.1",
  "report_date": "2026-10-04",
  "collection_window": {
    "start": "2026-10-03T09:00:00+09:00",
    "end": "2026-10-04T09:00:00+09:00",
    "timezone": "Asia/Seoul"
  },
  "sources": [
    "데일리팜",
    "의학신문",
    "메디파나뉴스",
    "약사공론"
  ],
  "briefing": "[제약공시 책갈피] 10월 1주차 - 동아제약·JW중외제약·일동제약 外 - 메디파나뉴스 · 바이엘도 미국행 신공장…22억달러 들여 '원료부터 완제품까지' - 메디파나뉴스 · 릴리, 비만약 다음은 '미용의학'…피부·얼굴·체형 신약 찾는다 - 메디파나뉴스",
  "top_news": [
    {
      "rank": 1,
      "canonical_issue": "[제약공시 책갈피] 10월 1주차 - 동아제약·JW중외제약·일동제약 外 - 메디파나뉴스",
      "title": "[제약공시 책갈피] 10월 1주차 - 동아제약·JW중외제약·일동제약 外 - 메디파나뉴스",
      "category": [
        "3상",
        "라이선스",
        "합병",
        "2상",
        "투자"
      ],
      "publishers": [
        "메디파나뉴스"
      ],
      "published_at": "2026-10-03T18:35:27+09:00",
      "published_at_verified": true,
      "summary": [
        "[메디파나뉴스 = 이정수 기자] 2026년 10월 1주차(9.28~10.2)에는 동아쏘시오홀딩스와 핵심 사업자회사인 동아제약 간의 흡수합병 절차가 최종 완료돼 통합 법인 상호가 '동아제약'으로 변경됐다. 동아쏘시오그룹은 경영 효율성 제고와 함께 지배구조 재편을 마무리했다. JW그룹이 바이오 벤처캐피털인 ",
        "글자크기 설정 가 가 기사의 본문 내용은 이 글자크기로 변경됩니다.",
        "[메디파나뉴스 = 이정수 기자] 2026년 10월 1주차(9.28~10.2)에는 동아쏘시오홀딩스와 핵심 사업자회사인 동아제약 간의 흡수합병 절차가 최종 완료돼 통합 법인 상호가 '동아제약'으로 변경됐다."
      ],
      "importance": "산업 중요도 규칙 기반 자동 선별 기사입니다. 편집 분석 문구는 후속 AI 검수 단계에서 보강합니다.",
      "source_urls": [
        "https://www.medipana.com/news/articleView.html?idxno=418723"
      ],
      "source_links": [
        {
          "publisher": "메디파나뉴스",
          "url": "https://www.medipana.com/news/articleView.html?idxno=418723"
        }
      ],
      "thumbnail_url": "https://cdn.medipana.com/news/photo/202610/418723_325975_3237.png",
      "score": 86,
      "oncology": null
    },
    {
      "rank": 2,
      "canonical_issue": "바이엘도 미국행 신공장…22억달러 들여 '원료부터 완제품까지' - 메디파나뉴스",
      "title": "바이엘도 미국행 신공장…22억달러 들여 '원료부터 완제품까지' - 메디파나뉴스",
      "category": [
        "허가",
        "투자",
        "공급"
      ],
      "publishers": [
        "메디파나뉴스"
      ],
      "published_at": "2026-10-03T13:59:23+09:00",
      "published_at_verified": true,
      "summary": [
        "독일 빅파마 바이엘이 미국에 22억달러를 투입해 대규모 의약품 생산시설을 짓는다. 장기 판매 의약품(mature products)을 정리하고, 사업 포트폴리오를 재편하는 동시에 성장 의약품과 신약 파이프라인의 핵심 시장인 미국에는 생산능력을 대폭 확대하는 모습이다. 2일 바이엘에 따르면 회사는 미국 오하",
        "글자크기 설정 가 가 기사의 본문 내용은 이 글자크기로 변경됩니다.",
        "ChatGPT 이미지 독일 빅파마 바이엘이 미국에 22억달러를 투입해 대규모 의약품 생산시설을 짓는다."
      ],
      "importance": "산업 중요도 규칙 기반 자동 선별 기사입니다. 편집 분석 문구는 후속 AI 검수 단계에서 보강합니다.",
      "source_urls": [
        "https://www.medipana.com/news/articleView.html?idxno=418718"
      ],
      "source_links": [
        {
          "publisher": "메디파나뉴스",
          "url": "https://www.medipana.com/news/articleView.html?idxno=418718"
        }
      ],
      "thumbnail_url": "https://cdn.medipana.com/news/photo/202610/418718_325969_3646.png",
      "score": 46,
      "oncology": null
    },
    {
      "rank": 3,
      "canonical_issue": "릴리, 비만약 다음은 '미용의학'…피부·얼굴·체형 신약 찾는다 - 메디파나뉴스",
      "title": "릴리, 비만약 다음은 '미용의학'…피부·얼굴·체형 신약 찾는다 - 메디파나뉴스",
      "category": [
        "인수",
        "투자"
      ],
      "publishers": [
        "메디파나뉴스"
      ],
      "published_at": "2026-10-03T15:53:35+09:00",
      "published_at_verified": true,
      "summary": [
        "비만치료제 시장을 주도하고 있는 일라이 릴리가 피부와 얼굴, 체형 등을 대상으로 하는 미용의학(Aesthetic Medicine)을 새로운 연구개발 영역으로 확대하고 있다. 단순히 기존 피부질환 치료제의 적응증을 넓히는 수준을 넘어 초기 임상개발 조직을 구축하고 외부 신약후보의 제휴·인수 가능성까지 검토",
        "글자크기 설정 가 가 기사의 본문 내용은 이 글자크기로 변경됩니다.",
        "ChatGPT 이미지 비만치료제 시장을 주도하고 있는 일라이 릴리가 피부와 얼굴, 체형 등을 대상으로 하는 미용의학(Aesthetic Medicine)을 새로운 연구개발 영역으로 확대하고 있다."
      ],
      "importance": "산업 중요도 규칙 기반 자동 선별 기사입니다. 편집 분석 문구는 후속 AI 검수 단계에서 보강합니다.",
      "source_urls": [
        "https://www.medipana.com/news/articleView.html?idxno=418722"
      ],
      "source_links": [
        {
          "publisher": "메디파나뉴스",
          "url": "https://www.medipana.com/news/articleView.html?idxno=418722"
        }
      ],
      "thumbnail_url": "https://cdn.medipana.com/news/photo/202610/418722_325973_3547.png",
      "score": 34,
      "oncology": null
    }
  ],
  "trends": [],
  "outlet_status": [
    {
      "publisher": "데일리팜",
      "homepage_url": "https://www.dailypharm.com/",
      "items": []
    },
    {
      "publisher": "의학신문",
      "homepage_url": "https://www.bosa.co.kr/",
      "items": []
    },
    {
      "publisher": "메디파나뉴스",
      "homepage_url": "https://www.medipana.com/",
      "items": [
        {
          "title": "[제약공시 책갈피] 10월 1주차 - 동아제약·JW중외제약·일동제약 外 - 메디파나뉴스",
          "published_at": "2026-10-03T18:35:27+09:00",
          "verified": true,
          "source_url": "https://www.medipana.com/news/articleView.html?idxno=418723"
        },
        {
          "title": "바이엘도 미국행 신공장…22억달러 들여 '원료부터 완제품까지' - 메디파나뉴스",
          "published_at": "2026-10-03T13:59:23+09:00",
          "verified": true,
          "source_url": "https://www.medipana.com/news/articleView.html?idxno=418718"
        },
        {
          "title": "릴리, 비만약 다음은 '미용의학'…피부·얼굴·체형 신약 찾는다 - 메디파나뉴스",
          "published_at": "2026-10-03T15:53:35+09:00",
          "verified": true,
          "source_url": "https://www.medipana.com/news/articleView.html?idxno=418722"
        }
      ]
    },
    {
      "publisher": "약사공론",
      "homepage_url": "https://www.kpanews.co.kr/",
      "items": []
    }
  ],
  "insight": "자동 수집·시간검증·중복통합 단계가 완료된 데이터입니다. 게시 전 분석 문구 QA를 권장합니다.",
  "infographic": {
    "image_path": null,
    "generated_at": null,
    "template_version": "news-card-v1"
  }
}