{
  "version": "1.2",
  "report_date": "2026-10-05",
  "collection_window": {
    "start": "2026-10-04T09:00:00+09:00",
    "end": "2026-10-05T09:00:00+09:00",
    "timezone": "Asia/Seoul"
  },
  "sources": [
    "데일리팜",
    "의학신문",
    "메디파나뉴스",
    "약사공론"
  ],
  "briefing": "美 이어 유럽까지 뚫은 '조코바'…일동제약 국내 재도전 주목가 오늘 가장 중요한 이슈로 부각됐습니다. 이어 비만약 열풍에 펩타이드 공장 키운다…SK팜테코, 美에 2억달러 투자도 주요 변화로 확인됐습니다. 전체적으로는 정책·급여 · 투자·사업개발 흐름이 두드러집니다.",
  "top_news": [
    {
      "rank": 1,
      "canonical_issue": "美 이어 유럽까지 뚫은 '조코바'…일동제약 국내 재도전 주목 - 메디파나뉴스",
      "title": "美 이어 유럽까지 뚫은 '조코바'…일동제약 국내 재도전 주목",
      "category": [
        "허가",
        "3상",
        "임상 3상"
      ],
      "publishers": [
        "메디파나뉴스"
      ],
      "published_at": "2026-10-05T05:50:00+09:00",
      "published_at_verified": true,
      "summary": [
        "일본 시오노기제약의 경구용 코로나19 항바이러스제 '조코바(성분명 엔시트렐비르)'가 미국에 이어 유럽에서도 코로나19 노출 후 예방 용도로 허가되면서 국내 판권을 보유한 일동제약의 품목허가 재도전 여부에도 관심이 쏠리고 있다. 일동제약은 앞서 국내 품목허가 신청을 자진취하하면서 글로벌 임상 3상 결과와 ",
        "일동제약은 앞서 국내 품목허가 신청을 자진취하하면서 글로벌 임상 3상 결과와 미국·유럽 허가 절차에서 확보되는 데이터를 반영해 다시 신청한다는 방침을 밝힌 바 있다.",
        "당시 언급했던 미국과 유럽의 규제 절차가 잇따라 승인으로 마무리되면서 국내 재신청을 둘러싼 환경도 달라진 셈이다."
      ],
      "importance": "허가·규제 변화는 치료 선택지와 제품 출시 시점, 시장 경쟁구도를 바꾸는 핵심 변수입니다.",
      "source_urls": [
        "https://www.medipana.com/news/articleView.html?idxno=418737"
      ],
      "source_links": [
        {
          "publisher": "메디파나뉴스",
          "url": "https://www.medipana.com/news/articleView.html?idxno=418737"
        }
      ],
      "thumbnail_url": "https://cdn.medipana.com/news/photo/202610/418737_325990_74.png",
      "score": 64,
      "oncology": null
    },
    {
      "rank": 2,
      "canonical_issue": "비만약 열풍에 펩타이드 공장 키운다…SK팜테코, 美에 2억달러 투자 - 메디파나뉴스",
      "title": "비만약 열풍에 펩타이드 공장 키운다…SK팜테코, 美에 2억달러 투자",
      "category": [
        "투자"
      ],
      "publishers": [
        "메디파나뉴스"
      ],
      "published_at": "2026-10-04T16:23:33+09:00",
      "published_at_verified": true,
      "summary": [
        "SK그룹의 의약품 위탁개발생산(CDMO) 계열사 SK팜테코가 미국 내 저분자 원료의약품(API)과 펩타이드 생산능력 확대에 2억달러 이상을 투자한다. 최근 비만·당뇨병 치료제 등을 중심으로 펩타이드 의약품 시장이 빠르게 성장하는 가운데 미국 현지 생산기반을 강화해 글로벌 수요에 대응하려는 전략으로 풀이된",
        "최근 비만·당뇨병 치료제 등을 중심으로 펩타이드 의약품 시장이 빠르게 성장하는 가운데 미국 현지 생산기반을 강화해 글로벌 수요에 대응하려는 전략으로 풀이된다.",
        "SK팜테코는 향후 5년간 미국 내 의약품 개발·생산 인프라 확대와 현대화에 2억달러 이상을 투자한다고 밝혔다."
      ],
      "importance": "생산·투자 확대는 공급망 안정성과 글로벌 사업 확장, 중장기 생산능력 경쟁과 연결됩니다.",
      "source_urls": [
        "https://www.medipana.com/news/articleView.html?idxno=418733"
      ],
      "source_links": [
        {
          "publisher": "메디파나뉴스",
          "url": "https://www.medipana.com/news/articleView.html?idxno=418733"
        }
      ],
      "thumbnail_url": "https://cdn.medipana.com/news/photo/202610/418733_325986_1447.png",
      "score": 19,
      "oncology": null
    },
    {
      "rank": 3,
      "canonical_issue": "[초점] 같은 CDMO, 돈 붓는 곳은 달랐다…삼성·SK·롯데 '3색 승부' - 메디파나뉴스",
      "title": "[초점] 같은 CDMO, 돈 붓는 곳은 달랐다…삼성·SK·롯데 '3색 승부'",
      "category": [
        "수가",
        "m&a",
        "인수"
      ],
      "publishers": [
        "메디파나뉴스"
      ],
      "published_at": "2026-10-05T05:55:00+09:00",
      "published_at_verified": true,
      "summary": [
        "국내 대형 의약품 위탁개발생산(CDMO) 기업들의 경쟁무대가 항체의약품을 넘어 펩타이드와 항체약물접합체(ADC) 등 차세대 모달리티로 빠르게 넓어지고 있다. 특히 삼성바이오로직스와 SK팜테코가 서로 다른 분야에서 성장했음에도 최근 펩타이드에서 접점을 만들고 있다는 점이 눈에 띈다. 삼성바이오로직스가 세계",
        "특히 삼성바이오로직스와 SK팜테코가 서로 다른 분야에서 성장했음에도 최근 펩타이드에서 접점을 만들고 있다는 점이 눈에 띈다.",
        "삼성바이오로직스가 세계 최대 수준의 항체 생산능력을 기반으로 펩타이드 사업을 새롭게 추가하는 방식이라면 SK팜테코는 저분자 의약품과 화학합성에서 축적한 역량을 펩타이드로 확대하고 있다."
      ],
      "importance": "생산·투자 확대는 공급망 안정성과 글로벌 사업 확장, 중장기 생산능력 경쟁과 연결됩니다.",
      "source_urls": [
        "https://www.medipana.com/news/articleView.html?idxno=418734"
      ],
      "source_links": [
        {
          "publisher": "메디파나뉴스",
          "url": "https://www.medipana.com/news/articleView.html?idxno=418734"
        }
      ],
      "thumbnail_url": "https://cdn.medipana.com/news/photo/202610/418734_325987_4017.png",
      "score": 18,
      "oncology": {
        "is_oncology": true,
        "cancer_types": [],
        "drug_generic": [],
        "drug_brand": [],
        "targets": [],
        "mechanism": [
          "ADC"
        ],
        "biomarkers": [],
        "trial_name": null,
        "phase": null,
        "line_of_therapy": null,
        "endpoints": {
          "orr": null,
          "pfs": null,
          "os": null,
          "hr": null,
          "grade3plus_ae": null
        },
        "approval_status": null,
        "reimbursement_status": null,
        "patient_summary": "치료와 직접 관련된 정보인지 기사 원문과 공식 자료를 함께 확인해 주세요.",
        "patient_relevance_score": 0,
        "patient_relevance_labels": [],
        "industry_summary": null
      }
    },
    {
      "rank": 4,
      "canonical_issue": "변사라 서울부민병원 간호사 결혼 - 메디파나뉴스",
      "title": "변사라 서울부민병원 간호사 결혼",
      "category": [
        "병원"
      ],
      "publishers": [
        "메디파나뉴스"
      ],
      "published_at": "2026-10-04T20:07:57+09:00",
      "published_at_verified": true,
      "summary": [
        "서울부민병원 수술실 변사라 간호사 결혼 ▲일시 : 2026년 10월 10일(토) 오후 4시 20분 ▲장소: 웨딩 시그니처 2층 트리니티홀",
        "서울부민병원 수술실 변사라 간호사 결혼 ▲일시 : 2026년 10월 10일(토) 오후 4시 20분 ▲장소: 웨딩 시그니처 2층 트리니티홀 이 기사를 공유합니다"
      ],
      "importance": "의료기관·약국 현장의 변화는 진료 흐름과 환자 경험, 의약품 사용 환경에 직접 영향을 줍니다.",
      "source_urls": [
        "https://www.medipana.com/news/articleView.html?idxno=418739"
      ],
      "source_links": [
        {
          "publisher": "메디파나뉴스",
          "url": "https://www.medipana.com/news/articleView.html?idxno=418739"
        }
      ],
      "thumbnail_url": "https://cdn.medipana.com/news/photo/202610/418739_325992_554.jpg",
      "score": 12,
      "oncology": null
    },
    {
      "rank": 5,
      "canonical_issue": "이정백 올리브애드 대표 빙부상 - 메디파나뉴스",
      "title": "이정백 올리브애드 대표 빙부상",
      "category": [
        "ai"
      ],
      "publishers": [
        "메디파나뉴스"
      ],
      "published_at": "2026-10-04T17:08:02+09:00",
      "published_at_verified": true,
      "summary": [
        "이정백 올리브애드 대표 빙부 별세. ▲빈소 : 안양장례식장 5호(경기도 안양시 동안구 엘에스로144번길 190(호계동) ▲발인 : 2026년 10월 5일(월) 오전 5시 30분 ▲장지 : 수원연화장",
        "▲빈소 : 안양장례식장 5호(경기도 안양시 동안구 엘에스로144번길 190(호계동) ▲발인 : 2026년 10월 5일(월) 오전 5시 30분 ▲장지 : 수원연화장 이 기사를 공유합니다"
      ],
      "importance": "시장·정책·연구개발 흐름을 보여주는 주요 산업 이슈로 후속 정책과 사업 변화 확인이 필요합니다.",
      "source_urls": [
        "https://www.medipana.com/news/articleView.html?idxno=418735"
      ],
      "source_links": [
        {
          "publisher": "메디파나뉴스",
          "url": "https://www.medipana.com/news/articleView.html?idxno=418735"
        }
      ],
      "thumbnail_url": "https://cdn.medipana.com/news/photo/202610/418735_325988_633.jpg",
      "score": 2,
      "oncology": null
    }
  ],
  "trends": [
    {
      "title": "정책·급여",
      "count": 2,
      "change": "2건의 주요 이슈에서 반복적으로 확인",
      "implication": "제도 변화가 시장 접근성과 현장 운영에 직접 영향을 주는 흐름",
      "examples": [
        "美 이어 유럽까지 뚫은 '조코바'…일동제약 국내 재도전 주목",
        "[초점] 같은 CDMO, 돈 붓는 곳은 달랐다…삼성·SK·롯데 '3색 승부'"
      ]
    },
    {
      "title": "투자·사업개발",
      "count": 2,
      "change": "2건의 주요 이슈에서 반복적으로 확인",
      "implication": "자본과 파이프라인 확보 경쟁이 사업전략의 핵심이 되는 흐름",
      "examples": [
        "비만약 열풍에 펩타이드 공장 키운다…SK팜테코, 美에 2억달러 투자",
        "[초점] 같은 CDMO, 돈 붓는 곳은 달랐다…삼성·SK·롯데 '3색 승부'"
      ]
    },
    {
      "title": "신약·임상",
      "count": 1,
      "change": "1건의 주요 이슈에서 반복적으로 확인",
      "implication": "허가·임상 성과가 치료 선택지와 경쟁구도를 바꾸는 흐름",
      "examples": [
        "美 이어 유럽까지 뚫은 '조코바'…일동제약 국내 재도전 주목"
      ]
    },
    {
      "title": "항암·정밀의료",
      "count": 1,
      "change": "1건의 주요 이슈에서 반복적으로 확인",
      "implication": "바이오마커·기전 중심 정밀의료 경쟁이 치료전략을 세분화하는 흐름",
      "examples": [
        "[초점] 같은 CDMO, 돈 붓는 곳은 달랐다…삼성·SK·롯데 '3색 승부'"
      ]
    }
  ],
  "outlet_status": [
    {
      "publisher": "데일리팜",
      "homepage_url": "https://www.dailypharm.com/",
      "items": []
    },
    {
      "publisher": "의학신문",
      "homepage_url": "https://www.bosa.co.kr/",
      "items": []
    },
    {
      "publisher": "메디파나뉴스",
      "homepage_url": "https://www.medipana.com/",
      "items": [
        {
          "title": "美 이어 유럽까지 뚫은 '조코바'…일동제약 국내 재도전 주목",
          "published_at": "2026-10-05T05:50:00+09:00",
          "verified": true,
          "source_url": "https://www.medipana.com/news/articleView.html?idxno=418737"
        },
        {
          "title": "비만약 열풍에 펩타이드 공장 키운다…SK팜테코, 美에 2억달러 투자",
          "published_at": "2026-10-04T16:23:33+09:00",
          "verified": true,
          "source_url": "https://www.medipana.com/news/articleView.html?idxno=418733"
        },
        {
          "title": "[초점] 같은 CDMO, 돈 붓는 곳은 달랐다…삼성·SK·롯데 '3색 승부'",
          "published_at": "2026-10-05T05:55:00+09:00",
          "verified": true,
          "source_url": "https://www.medipana.com/news/articleView.html?idxno=418734"
        },
        {
          "title": "변사라 서울부민병원 간호사 결혼",
          "published_at": "2026-10-04T20:07:57+09:00",
          "verified": true,
          "source_url": "https://www.medipana.com/news/articleView.html?idxno=418739"
        },
        {
          "title": "이정백 올리브애드 대표 빙부상",
          "published_at": "2026-10-04T17:08:02+09:00",
          "verified": true,
          "source_url": "https://www.medipana.com/news/articleView.html?idxno=418735"
        }
      ]
    },
    {
      "publisher": "약사공론",
      "homepage_url": "https://www.kpanews.co.kr/",
      "items": []
    }
  ],
  "insight": "제도 변화가 시장 접근성과 현장 운영에 직접 영향을 주는 흐름 동시에 투자·사업개발 흐름도 함께 확인돼 단일 이슈보다 복합적인 산업 변화로 보는 것이 적절합니다.",
  "infographic": {
    "image_path": null,
    "generated_at": null,
    "template_version": "news-card-v1"
  }
}