{
  "version": "1.2",
  "report_date": "2026-10-25",
  "collection_window": {
    "start": "2026-10-24T09:00:00+09:00",
    "end": "2026-10-25T09:00:00+09:00",
    "timezone": "Asia/Seoul"
  },
  "sources": [
    "데일리팜",
    "의학신문",
    "메디파나뉴스",
    "약사공론"
  ],
  "briefing": "[제약공시 책갈피] 10월 4주차 - 저PBR제약사·셀트리온 外가 오늘 가장 중요한 이슈로 부각됐습니다. 이어 공보의 부족한데 시니어의사 채용도 예산이 발목 잡아도 주요 변화로 확인됐습니다. 전체적으로는 디지털헬스 · 신약·임상 흐름이 두드러집니다.",
  "top_news": [
    {
      "rank": 1,
      "canonical_issue": "[제약공시 책갈피] 10월 4주차 - 저PBR제약사·셀트리온 外 - 메디파나뉴스",
      "title": "[제약공시 책갈피] 10월 4주차 - 저PBR제약사·셀트리온 外",
      "category": [
        "허가",
        "라이선스",
        "2상",
        "투자"
      ],
      "publishers": [
        "메디파나뉴스"
      ],
      "published_at": "2026-10-25T06:00:00+09:00",
      "published_at_verified": true,
      "summary": [
        "[메디파나뉴스 = 이정수 기자] 2026년 10월 4주차(10.19~10.23)에는 비씨월드제약, 신일제약, 팜젠사이언스, 제일파마홀딩스 등 다수 제약사가 한국거래소의 PBR 개선 요구에 따라 주식 시장 내 저평가를 해소하기 위해 수년 내 PBR 상향, ROE 제고, 주주환원 확대 등 중장기 목표와 계획",
        "복사하기 [메디파나뉴스 = 이정수 기자] 2026년 10월 4주차(10.19~10.23)에는 비씨월드제약, 신일제약, 팜젠사이언스, 제일파마홀딩스 등 다수 제약사가 한국거래소의 PBR 개선 요구에 따라 주식 시장 내 저평가를 해소하기 위해 수년 내 PBR 상향, ROE 제고, 주주환원 확대 등 중장기 목표와 계획을 공개했",
        "셀트리온이 미국 카이진으로부터 면역질환을 타깃으로 하는 장기 지속형 신약 후보물질 'KG013'을 최대 7700억원 규모로 도입하는 라이선스-인 계약을 체결했다."
      ],
      "importance": "기사에서 사업개발·투자 변화가 함께 확인돼 기업 포트폴리오와 경쟁구도 영향을 살펴볼 필요가 있습니다.",
      "source_urls": [
        "https://www.medipana.com/news/articleView.html?idxno=420008"
      ],
      "source_links": [
        {
          "publisher": "메디파나뉴스",
          "url": "https://www.medipana.com/news/articleView.html?idxno=420008"
        }
      ],
      "thumbnail_url": "https://cdn.medipana.com/news/photo/202610/420008_327622_344.png",
      "score": 20,
      "oncology": null
    },
    {
      "rank": 2,
      "canonical_issue": "공보의 부족한데 시니어의사 채용도 예산이 발목 잡아 - 의학신문",
      "title": "공보의 부족한데 시니어의사 채용도 예산이 발목 잡아",
      "category": [
        "복지부",
        "ai"
      ],
      "publishers": [
        "의학신문"
      ],
      "published_at": "2026-10-24T13:37:55+09:00",
      "published_at_verified": true,
      "summary": [
        "[의학신문·일간보사=김현기 기자] 농어촌과 의료취약지의 공중보건의사 부족이 심화되는 가운데, 정부가 대안으로 추진하는 시니어의사 채용지원사업마저 예산 부족으로 현",
        "[의학신문·일간보사=김현기 기자] 농어촌과 의료취약지의 공중보건의사 부족이 심화되는 가운데, 정부가 대안으로 추진하는 시니어의사 채용지원사업마저 예산 부족으로 현장 수요를 충족하지 못하고 있는 것으로 드러났다.",
        "특히 공보의 감소에 직접적인 영향을 받는 보건소는 신청 인원의 4분의 1도 지원받지 못해 지역 공공의료 공백을 메우기 위한 실효성 있는 대책이 필요하다는 지적이다."
      ],
      "importance": "시장·정책·연구개발 흐름을 보여주는 주요 산업 이슈로 후속 정책과 사업 변화 확인이 필요합니다.",
      "source_urls": [
        "https://www.bosa.co.kr/news/articleView.html?idxno=3014722"
      ],
      "source_links": [
        {
          "publisher": "의학신문",
          "url": "https://www.bosa.co.kr/news/articleView.html?idxno=3014722"
        }
      ],
      "thumbnail_url": "https://www.bosa.co.kr/image/logo/snslogotrans_20251212052521.png",
      "score": 9,
      "oncology": null
    },
    {
      "rank": 3,
      "canonical_issue": "납 수치 조작 의혹에 항노화 홍보까지...킬레이션 주사제 논란 확산 - 의학신문",
      "title": "납 수치 조작 의혹에 항노화 홍보까지...킬레이션 주사제 논란 확산",
      "category": [
        "ai"
      ],
      "publishers": [
        "의학신문"
      ],
      "published_at": "2026-10-24T14:12:17+09:00",
      "published_at_verified": true,
      "summary": [
        "[의학신문·일간보사=김현기 기자] 노동자의 혈중 납 농도를 인위적으로 낮추기 위한 킬레이션 주사제 투약 의혹이 불거진 가운데 의료계가 의약품의 부적절한 사용에 제",
        "[의학신문·일간보사=김현기 기자] 노동자의 혈중 납 농도를 인위적으로 낮추기 위한 킬레이션 주사제 투약 의혹이 불거진 가운데 의료계가 의약품의 부적절한 사용에 제동을 걸고 나섰다.",
        "피로회복과 항노화 등 의학적 근거가 부족한 효능을 내세운 홍보까지 문제로 지목되면서 약물 사용의 적정성과 환자 안전을 둘러싼 논란이 확산되는 분위기다."
      ],
      "importance": "시장·정책·연구개발 흐름을 보여주는 주요 산업 이슈로 후속 정책과 사업 변화 확인이 필요합니다.",
      "source_urls": [
        "https://www.bosa.co.kr/news/articleView.html?idxno=3014723"
      ],
      "source_links": [
        {
          "publisher": "의학신문",
          "url": "https://www.bosa.co.kr/news/articleView.html?idxno=3014723"
        }
      ],
      "thumbnail_url": "https://www.bosa.co.kr/image/logo/snslogotrans_20251212052521.png",
      "score": 3,
      "oncology": null
    }
  ],
  "trends": [
    {
      "title": "디지털헬스",
      "count": 2,
      "change": "2건의 주요 이슈에서 반복적으로 확인",
      "implication": "AI·플랫폼 기반 의료서비스가 제도와 사업모델 변화로 이어지는 흐름",
      "examples": [
        "공보의 부족한데 시니어의사 채용도 예산이 발목 잡아",
        "납 수치 조작 의혹에 항노화 홍보까지...킬레이션 주사제 논란 확산"
      ]
    },
    {
      "title": "신약·임상",
      "count": 1,
      "change": "1건의 주요 이슈에서 반복적으로 확인",
      "implication": "허가·임상 성과가 치료 선택지와 경쟁구도를 바꾸는 흐름",
      "examples": [
        "[제약공시 책갈피] 10월 4주차 - 저PBR제약사·셀트리온 外"
      ]
    },
    {
      "title": "투자·사업개발",
      "count": 1,
      "change": "1건의 주요 이슈에서 반복적으로 확인",
      "implication": "자본과 파이프라인 확보 경쟁이 사업전략의 핵심이 되는 흐름",
      "examples": [
        "[제약공시 책갈피] 10월 4주차 - 저PBR제약사·셀트리온 外"
      ]
    },
    {
      "title": "정책·급여",
      "count": 1,
      "change": "1건의 주요 이슈에서 반복적으로 확인",
      "implication": "제도 변화가 시장 접근성과 현장 운영에 직접 영향을 주는 흐름",
      "examples": [
        "공보의 부족한데 시니어의사 채용도 예산이 발목 잡아"
      ]
    }
  ],
  "outlet_status": [
    {
      "publisher": "데일리팜",
      "homepage_url": "https://www.dailypharm.com/",
      "items": []
    },
    {
      "publisher": "의학신문",
      "homepage_url": "https://www.bosa.co.kr/",
      "items": [
        {
          "title": "공보의 부족한데 시니어의사 채용도 예산이 발목 잡아",
          "published_at": "2026-10-24T13:37:55+09:00",
          "verified": true,
          "source_url": "https://www.bosa.co.kr/news/articleView.html?idxno=3014722"
        },
        {
          "title": "납 수치 조작 의혹에 항노화 홍보까지...킬레이션 주사제 논란 확산",
          "published_at": "2026-10-24T14:12:17+09:00",
          "verified": true,
          "source_url": "https://www.bosa.co.kr/news/articleView.html?idxno=3014723"
        }
      ]
    },
    {
      "publisher": "메디파나뉴스",
      "homepage_url": "https://www.medipana.com/",
      "items": [
        {
          "title": "[제약공시 책갈피] 10월 4주차 - 저PBR제약사·셀트리온 外",
          "published_at": "2026-10-25T06:00:00+09:00",
          "verified": true,
          "source_url": "https://www.medipana.com/news/articleView.html?idxno=420008"
        }
      ]
    },
    {
      "publisher": "약사공론",
      "homepage_url": "https://www.kpanews.co.kr/",
      "items": []
    }
  ],
  "insight": "AI·플랫폼 기반 의료서비스가 제도와 사업모델 변화로 이어지는 흐름 동시에 신약·임상 흐름도 함께 확인돼 단일 이슈보다 복합적인 산업 변화로 보는 것이 적절합니다.",
  "infographic": {
    "image_path": null,
    "generated_at": null,
    "template_version": "news-card-v1"
  }
}